{"schema_version":"2","part_id":"P01","t_s":[0.0,0.2247,0.4494,0.6742,0.8989,1.1236,1.3483,2.2403,3.1323,4.0243,4.091,4.1577,4.2243,4.6212,5.018,5.4148,5.8117,6.2085,6.6053,7.0022,7.399,7.7958,8.1927,8.5895,8.9863,9.3832,9.78,10.1229,10.5198,10.9166,11.3134,11.594,11.9909,12.3877,12.7845,13.1814,13.5782,13.975,14.3719,14.7687,15.1655,15.5624,15.9592,16.356,16.7529,17.1137,17.5105,17.9073,18.3042,18.701,18.7677,18.8343,18.901,18.951,19.001,19.051,19.101,19.151,19.201,19.251,19.301,19.351,19.401,19.451,19.501,19.5677,19.6343,19.701,20.0972,20.4934,20.8897,21.2859,21.6821,22.0783,22.4745,22.8708,23.267,23.6632,24.0594,24.4556,24.8179,25.2141,25.6104,25.8905,26.2868,26.683,27.0792,27.4754,27.8716,28.2679,28.6641,29.0603,29.4565,29.8527,30.249,30.6452,30.9862,31.3824,31.7786,31.8453,31.912,31.9786,32.0286,32.0786,32.1286,32.1786,32.2286,32.2786,32.3286,32.3786,32.4286,32.4786,32.5286,32.5786,32.6286,32.6786,32.7453,32.812,32.8786,33.2755,33.6723,34.0691,34.466,34.8628,35.2596,35.6565,36.0533,36.4501,36.847,37.2438,37.6406,38.0375,38.4343,38.7772,39.1741,39.5709,39.9677,40.2483,40.6452,41.042,41.4388,41.8357,42.2325,42.6293,43.0262,43.423,43.8198,44.2167,44.6135,45.0103,45.4072,45.768,46.1648,46.5616,46.9585,47.3553,47.422,47.4886,47.5553,47.6053,47.6553,47.7053,47.7553,47.8053,47.8553,47.9053,47.9553,48.0053,48.0553,48.1053,48.1553,48.222,48.2886,48.3553,48.7515,49.1477,49.5439,49.9402,50.3364,50.7326,51.1288,51.5251,51.9213,52.3175,52.7137,53.1099,53.4722,53.8684,54.2647,54.5448,54.941,55.3373,55.7335,56.1297,56.5259,56.9222,57.3184,57.7146,58.1108,58.507,58.9033,59.2995,59.6405,60.0367,60.4329,60.4996,60.5662,60.6329,60.6829,60.7329,60.7829,60.8329,60.8829,60.9329,60.9829,61.0329,61.0829,61.1329,61.1829,61.2329,61.2829,61.3329,61.3996,61.4662,61.5329,61.9297,62.3266,62.7234,63.1202,63.5171,63.9139,64.3107,64.7076,65.1044,65.5012,65.8981,66.2949,66.6917,67.0886,67.4315,67.8283,68.2252,68.622,68.9026,69.2994,69.6963,70.0931,70.4899,70.8868,71.2836,71.6804,72.0773,72.4741,72.8709,73.2678,73.6646,74.0614,74.4222,74.8191,75.2159,75.6127,76.0096,76.0762,76.1429,76.2096,76.2596,76.3096,76.3596,76.4096,76.4596,76.5096,76.5596,76.6096,76.6596,76.7096,76.7596,76.8096,76.8762,76.9429,77.0096,77.4058,77.802,78.1982,78.5945,78.9907,79.3869,79.7831,80.1793,80.5756,80.9718,81.368,81.7642,82.1265,82.5227,82.9189,83.1991,83.5953,83.9916,84.3878,84.784,85.1802,85.5764,85.9727,86.3689,86.7651,87.1613,87.5575,87.9538,88.2947,88.691,89.0872,89.1539,89.2205,89.2872,89.3372,89.3872,89.4372,89.4872,89.5372,89.5872,89.6372,89.6872,89.7372,89.7872,89.8372,89.8872,89.9372,89.9872,90.0539,90.1205,90.1872,90.584,90.9809,91.3777,91.7745,92.1714,92.5682,92.965,93.3619,93.7587,94.1555,94.5524,94.9492,95.346,95.7429,96.0858,96.4826,96.8795,97.2763,97.5569,97.9537,98.3506,98.7474,99.1442,99.5411,99.9379,100.3347,100.7316,101.1284,101.5252,101.9221,102.3189,102.7157,103.0765,103.4734,103.8702,104.267,104.6639,104.7305,104.7972,104.8639,104.9139,104.9639,105.0139,105.0639,105.1139,105.1639,105.2139,105.2639,105.3139,105.3639,105.4139,105.4639,105.5305,105.5972,105.6639,106.0601,106.4563,106.8525,107.2487,107.645,108.0412,108.4374,108.8336,109.2298,109.6261,110.0223,110.4185,110.7808,111.177,111.5732,111.8534,112.2496,112.6458,113.0421,113.4383,113.8345,114.2307,114.6269,115.0232,115.4194,115.8156,116.2118,116.608,116.949,117.3453,117.7415,117.8081,117.8748,117.9415],"q":[[0.0,0.0,1.570796,0.0,1.570796,0.0],[-0.04275,-0.015,1.555796,-0.0095,1.561796,-0.00475],[-0.0855,-0.03,1.540796,-0.019,1.552796,-0.0095],[-0.12825,-0.045,1.525796,-0.0285,1.543796,-0.01425],[-0.171,-0.06,1.510796,-0.038,1.534796,-0.019],[-0.21375,-0.075,1.495796,-0.0475,1.525796,-0.02375],[-0.2565,-0.09,1.480796,-0.057,1.516796,-0.0285],[-0.2565,-0.0454,1.569996,-0.057,1.516796,-0.0285],[-0.2565,-0.0008,1.659196,-0.057,1.516796,-0.0285],[-0.2565,0.0438,1.748396,-0.057,1.516796,-0.0285],[-0.2565,0.045133,1.751063,-0.057,1.516796,-0.0285],[-0.2565,0.046467,1.75373,-0.057,1.516796,-0.0285],[-0.2565,0.0478,1.756396,-0.057,1.516796,-0.0285],[-0.220785,0.0478,1.756396,-0.049063,1.516796,-0.024532],[-0.18507,0.0478,1.756396,-0.041127,1.516796,-0.020563],[-0.149355,0.0478,1.756396,-0.03319,1.516796,-0.016595],[-0.11364,0.0478,1.756396,-0.025253,1.516796,-0.012627],[-0.077925,0.0478,1.756396,-0.017317,1.516796,-0.008658],[-0.04221,0.0478,1.756396,-0.00938,1.516796,-0.00469],[-0.006495,0.0478,1.756396,-0.001443,1.516796,-0.000722],[0.02922,0.0478,1.756396,0.006493,1.516796,0.003247],[0.064935,0.0478,1.756396,0.01443,1.516796,0.007215],[0.10065,0.0478,1.756396,0.022367,1.516796,0.011183],[0.136365,0.0478,1.756396,0.030303,1.516796,0.015152],[0.17208,0.0478,1.756396,0.03824,1.516796,0.01912],[0.207795,0.0478,1.756396,0.046177,1.516796,0.023088],[0.24351,0.0478,1.756396,0.054113,1.516796,0.027057],[0.2565,0.063354,1.77195,0.057,1.526129,0.0285],[0.2565,0.083196,1.791792,0.057,1.538034,0.0285],[0.2565,0.103037,1.811634,0.057,1.549939,0.0285],[0.2565,0.122879,1.831475,0.057,1.561844,0.0285],[0.238642,0.1328,1.841396,0.053032,1.567796,0.026516],[0.202927,0.1328,1.841396,0.045095,1.567796,0.022547],[0.167212,0.1328,1.841396,0.037158,1.567796,0.018579],[0.131497,0.1328,1.841396,0.029222,1.567796,0.014611],[0.095782,0.1328,1.841396,0.021285,1.567796,0.010642],[0.060067,0.1328,1.841396,0.013348,1.567796,0.006674],[0.024352,0.1328,1.841396,0.005412,1.567796,0.002706],[-0.011363,0.1328,1.841396,-0.002525,1.567796,-0.001263],[-0.047078,0.1328,1.841396,-0.010462,1.567796,-0.005231],[-0.082793,0.1328,1.841396,-0.018398,1.567796,-0.009199],[-0.118508,0.1328,1.841396,-0.026335,1.567796,-0.013168],[-0.154223,0.1328,1.841396,-0.034272,1.567796,-0.017136],[-0.189938,0.1328,1.841396,-0.042208,1.567796,-0.021104],[-0.225653,0.1328,1.841396,-0.050145,1.567796,-0.025073],[-0.2565,0.127167,1.835763,-0.057,1.564416,-0.0285],[-0.2565,0.107325,1.815921,-0.057,1.552511,-0.0285],[-0.2565,0.087483,1.79608,-0.057,1.540606,-0.0285],[-0.2565,0.067642,1.776238,-0.057,1.528701,-0.0285],[-0.2565,0.0478,1.756396,-0.057,1.516796,-0.0285],[-0.2565,0.046467,1.75373,-0.057,1.516796,-0.0285],[-0.2565,0.045133,1.751063,-0.057,1.516796,-0.0285],[-0.2565,0.0438,1.748396,-0.057,1.516796,-0.0285],[-0.2565,0.043133,1.747063,-0.057,1.516796,-0.0285],[-0.2565,0.042467,1.74573,-0.057,1.516796,-0.0285],[-0.2565,0.0418,1.744396,-0.057,1.516796,-0.0285],[-0.252,0.0443,1.746896,-0.056,1.518296,-0.028],[-0.2475,0.0468,1.749396,-0.055,1.519796,-0.0275],[-0.243,0.0493,1.751896,-0.054,1.521296,-0.027],[-0.2385,0.0518,1.754396,-0.053,1.522796,-0.0265],[-0.234,0.0543,1.756896,-0.052,1.524296,-0.026],[-0.2295,0.0568,1.759396,-0.051,1.525796,-0.0255],[-0.2295,0.057467,1.76073,-0.051,1.525796,-0.0255],[-0.2295,0.058133,1.762063,-0.051,1.525796,-0.0255],[-0.2295,0.0588,1.763396,-0.051,1.525796,-0.0255],[-0.2295,0.060133,1.766063,-0.051,1.525796,-0.0255],[-0.2295,0.061467,1.76873,-0.051,1.525796,-0.0255],[-0.2295,0.0628,1.771396,-0.051,1.525796,-0.0255],[-0.19384,0.0628,1.771396,-0.043076,1.525796,-0.021538],[-0.15818,0.0628,1.771396,-0.035151,1.525796,-0.017576],[-0.12252,0.0628,1.771396,-0.027227,1.525796,-0.013613],[-0.086861,0.0628,1.771396,-0.019302,1.525796,-0.009651],[-0.051201,0.0628,1.771396,-0.011378,1.525796,-0.005689],[-0.015541,0.0628,1.771396,-0.003454,1.525796,-0.001727],[0.020119,0.0628,1.771396,0.004471,1.525796,0.002235],[0.055779,0.0628,1.771396,0.012395,1.525796,0.006198],[0.091439,0.0628,1.771396,0.02032,1.525796,0.01016],[0.127099,0.0628,1.771396,0.028244,1.525796,0.014122],[0.162759,0.0628,1.771396,0.036169,1.525796,0.018084],[0.198418,0.0628,1.771396,0.044093,1.525796,0.022046],[0.2295,0.068272,1.776869,0.051,1.52908,0.0255],[0.2295,0.088083,1.79668,0.051,1.540966,0.0255],[0.2295,0.107894,1.816491,0.051,1.552853,0.0255],[0.21167,0.1178,1.826396,0.047038,1.558796,0.023519],[0.17601,0.1178,1.826396,0.039113,1.558796,0.019557],[0.14035,0.1178,1.826396,0.031189,1.558796,0.015594],[0.10469,0.1178,1.826396,0.023265,1.558796,0.011632],[0.069031,0.1178,1.826396,0.01534,1.558796,0.00767],[0.033371,0.1178,1.826396,0.007416,1.558796,0.003708],[-0.002289,0.1178,1.826396,-0.000509,1.558796,-0.000254],[-0.037949,0.1178,1.826396,-0.008433,1.558796,-0.004217],[-0.073609,0.1178,1.826396,-0.016358,1.558796,-0.008179],[-0.109269,0.1178,1.826396,-0.024282,1.558796,-0.012141],[-0.144929,0.1178,1.826396,-0.032206,1.558796,-0.016103],[-0.180588,0.1178,1.826396,-0.040131,1.558796,-0.020065],[-0.216248,0.1178,1.826396,-0.048055,1.558796,-0.024028],[-0.2295,0.102422,1.811018,-0.051,1.54957,-0.0255],[-0.2295,0.082611,1.791207,-0.051,1.537683,-0.0255],[-0.2295,0.0628,1.771396,-0.051,1.525796,-0.0255],[-0.2295,0.061467,1.76873,-0.051,1.525796,-0.0255],[-0.2295,0.060133,1.766063,-0.051,1.525796,-0.0255],[-0.2295,0.0588,1.763396,-0.051,1.525796,-0.0255],[-0.2295,0.058133,1.762063,-0.051,1.525796,-0.0255],[-0.2295,0.057467,1.76073,-0.051,1.525796,-0.0255],[-0.2295,0.0568,1.759396,-0.051,1.525796,-0.0255],[-0.2295,0.0558,1.757396,-0.051,1.525796,-0.0255],[-0.2295,0.0548,1.755396,-0.051,1.525796,-0.0255],[-0.234,0.0523,1.752896,-0.052,1.524296,-0.026],[-0.2385,0.0498,1.750396,-0.053,1.522796,-0.0265],[-0.243,0.0473,1.747896,-0.054,1.521296,-0.027],[-0.2475,0.0448,1.745396,-0.055,1.519796,-0.0275],[-0.252,0.0423,1.742896,-0.056,1.518296,-0.028],[-0.2565,0.0398,1.740396,-0.057,1.516796,-0.0285],[-0.2565,0.040467,1.74173,-0.057,1.516796,-0.0285],[-0.2565,0.041133,1.743063,-0.057,1.516796,-0.0285],[-0.2565,0.0418,1.744396,-0.057,1.516796,-0.0285],[-0.2565,0.043133,1.747063,-0.057,1.516796,-0.0285],[-0.2565,0.044467,1.74973,-0.057,1.516796,-0.0285],[-0.2565,0.0458,1.752396,-0.057,1.516796,-0.0285],[-0.220785,0.0458,1.752396,-0.049063,1.516796,-0.024532],[-0.18507,0.0458,1.752396,-0.041127,1.516796,-0.020563],[-0.149355,0.0458,1.752396,-0.03319,1.516796,-0.016595],[-0.11364,0.0458,1.752396,-0.025253,1.516796,-0.012627],[-0.077925,0.0458,1.752396,-0.017317,1.516796,-0.008658],[-0.04221,0.0458,1.752396,-0.00938,1.516796,-0.00469],[-0.006495,0.0458,1.752396,-0.001443,1.5167